{
  "last_updated": "2026-10-28 10:02:33 IST",
  "multiplier": 1.0,
  "regime_state": "risk_on",
  "risk_off_triggers": [],
  "indicators": {
    "india_vix": {
      "label": "India VIX",
      "value": 14.85,
      "change": -0.45,
      "unit": "pts",
      "state": "risk_on",
      "description": "NSE Volatility Index. Values > 20 indicate elevated risk."
    },
    "vix_vix3m": {
      "label": "VIX / VIX3M",
      "value": 0.89,
      "change": -0.02,
      "unit": "ratio",
      "state": "risk_on",
      "description": "Volatility term structure. Inversion (> 1.05) signals panic."
    },
    "dxy_20d": {
      "label": "DXY 20D",
      "value": 103.4,
      "change": 0.85,
      "unit": "%",
      "state": "neutral",
      "description": "US Dollar Index 20-day momentum."
    },
    "us10y_20d_bps": {
      "label": "US 10Y Yield",
      "value": 4.18,
      "change": 8.0,
      "unit": "bps",
      "state": "neutral",
      "description": "US 10-Year Treasury Yield 20-day change in basis points."
    },
    "usdinr_20d": {
      "label": "USD / INR",
      "value": 85.12,
      "change": 0.25,
      "unit": "%",
      "state": "neutral",
      "description": "USD/INR exchange rate 20-day change."
    },
    "brent_crude": {
      "label": "Brent Crude",
      "value": 78.4,
      "change": -1.8,
      "unit": "$/bbl",
      "state": "neutral",
      "description": "Brent crude oil price per barrel."
    },
    "fii_flow_5d": {
      "label": "FII Net 5D",
      "value": -3420.0,
      "change": -1200.0,
      "unit": "Cr",
      "state": "neutral",
      "description": "FII cash plus index futures 5-day net flow in INR Crores."
    },
    "gift_nifty_gap": {
      "label": "GIFT Nifty Gap",
      "value": 0.15,
      "change": 0.15,
      "unit": "%",
      "state": "neutral",
      "description": "GIFT Nifty overnight opening cushion / gap."
    },
    "fno_breadth": {
      "label": "F&O 50DMA Breadth",
      "value": 58.4,
      "change": 2.1,
      "unit": "%",
      "state": "neutral",
      "description": "Percentage of F&O underlyings trading above their 50-day moving average."
    },
    "nifty_gex": {
      "label": "Nifty Gamma (GEX)",
      "value": 1.0,
      "change": 1.0,
      "unit": "sign",
      "state": "risk_on",
      "description": "Dealer Gamma sign: Positive (stabilizing) vs Negative (accelerating). Zero Gamma: 24,150."
    }
  }
}